{
  "version": {
    "major": 1,
    "minor": 0
  },
  "source": {
    "signals": "manual/spec/signals.yaml",
    "alarms": "manual/spec/alarms.yaml",
    "settings": "manual/spec/settings.yaml",
    "signals_sha256": "031393028087df1d747c71208997916fd5c14553976176d31770a418822e64c0",
    "alarms_sha256": "fd650b019dcb3c9655987268fd094a2310a2845e64157a888bd134ec659809d4",
    "settings_sha256": "d00532b81d4e74c7931e6828557efb2357e72bc4ddbd0dabdaed95750b6aa20f",
    "provisional": false
  },
  "modbus": {
    "unit_id": 1,
    "function_code": 3,
    "word_order": "big_endian_high_word_first"
  },
  "encoding": {
    "analog": "int16_scaled",
    "digital": "uint16_bool",
    "u32": "two_registers_high_first",
    "u64": "four_registers_high_first"
  },
  "header": {
    "base": 0,
    "regs": 32,
    "fields": [
      {
        "name": "head_seq",
        "offset": 0,
        "type": "u32"
      },
      {
        "name": "sim_ts_now",
        "offset": 2,
        "type": "u64",
        "unit": "epoch_ms"
      },
      {
        "name": "replay_state",
        "offset": 6,
        "type": "u16",
        "enum": {
          "0": "stopped",
          "1": "playing",
          "2": "paused"
        }
      },
      {
        "name": "replay_speed",
        "offset": 7,
        "type": "u16"
      },
      {
        "name": "ring_slots",
        "offset": 8,
        "type": "u16"
      },
      {
        "name": "slot_regs",
        "offset": 9,
        "type": "u16"
      },
      {
        "name": "ring_base",
        "offset": 10,
        "type": "u32"
      },
      {
        "name": "map_major",
        "offset": 12,
        "type": "u16"
      },
      {
        "name": "map_minor",
        "offset": 13,
        "type": "u16"
      }
    ]
  },
  "ring": {
    "base": 1024,
    "slots": 256,
    "slot_regs": 32
  },
  "slot": {
    "fields": [
      {
        "name": "seq",
        "offset": 0,
        "type": "u32"
      },
      {
        "name": "sim_ts",
        "offset": 2,
        "type": "u64",
        "unit": "epoch_ms"
      },
      {
        "name": "flags",
        "offset": 6,
        "type": "u16",
        "bits": {
          "discontinuity": 0,
          "missing": 1
        }
      },
      {
        "name": "discharge_pressure",
        "offset": 7,
        "type": "i16",
        "scale": 1000,
        "unit": "bar",
        "signal": "discharge_pressure"
      },
      {
        "name": "line_pressure",
        "offset": 8,
        "type": "i16",
        "scale": 1000,
        "unit": "bar",
        "signal": "line_pressure"
      },
      {
        "name": "separator_discharge_pressure",
        "offset": 9,
        "type": "i16",
        "scale": 1000,
        "unit": "bar",
        "signal": "separator_discharge_pressure"
      },
      {
        "name": "dryer_purge_pressure",
        "offset": 10,
        "type": "i16",
        "scale": 1000,
        "unit": "bar",
        "signal": "dryer_purge_pressure"
      },
      {
        "name": "reservoir_pressure",
        "offset": 11,
        "type": "i16",
        "scale": 1000,
        "unit": "bar",
        "signal": "reservoir_pressure"
      },
      {
        "name": "oil_temperature",
        "offset": 12,
        "type": "i16",
        "scale": 100,
        "unit": "degC",
        "signal": "oil_temperature"
      },
      {
        "name": "motor_current",
        "offset": 13,
        "type": "i16",
        "scale": 100,
        "unit": "A",
        "signal": "motor_current"
      },
      {
        "name": "intake_closed",
        "offset": 14,
        "type": "u16",
        "signal": "intake_closed"
      },
      {
        "name": "load_valve",
        "offset": 15,
        "type": "u16",
        "signal": "load_valve"
      },
      {
        "name": "dryer_tower",
        "offset": 16,
        "type": "u16",
        "signal": "dryer_tower"
      },
      {
        "name": "regulator_contact",
        "offset": 17,
        "type": "u16",
        "signal": "regulator_contact"
      },
      {
        "name": "low_pressure_switch",
        "offset": 18,
        "type": "u16",
        "signal": "low_pressure_switch"
      },
      {
        "name": "purge_switch",
        "offset": 19,
        "type": "u16",
        "signal": "purge_switch"
      },
      {
        "name": "oil_level_ok",
        "offset": 20,
        "type": "u16",
        "signal": "oil_level_ok"
      },
      {
        "name": "flow_pulse",
        "offset": 21,
        "type": "u16",
        "signal": "flow_pulse"
      },
      {
        "name": "ambient_temperature",
        "offset": 22,
        "type": "i16",
        "scale": 100,
        "unit": "degC",
        "signal": "ambient_temperature"
      },
      {
        "name": "alarm_bits",
        "offset": 23,
        "type": "u32"
      }
    ]
  },
  "signals": [
    {
      "tag": "discharge_pressure",
      "label": "P1",
      "name": "Discharge pressure",
      "metropt_column": "TP2",
      "group": "analog",
      "kind": "pressure",
      "unit": "bar",
      "subsystem": "compressor",
      "scale": 1000,
      "offset": 7,
      "range": [
        -1,
        16
      ]
    },
    {
      "tag": "line_pressure",
      "label": "P2",
      "name": "Line pressure",
      "metropt_column": "TP3",
      "group": "analog",
      "kind": "pressure",
      "unit": "bar",
      "subsystem": "reservoirs",
      "scale": 1000,
      "offset": 8,
      "range": [
        -1,
        16
      ]
    },
    {
      "tag": "separator_discharge_pressure",
      "label": "P3",
      "name": "Separator discharge pressure",
      "metropt_column": "H1",
      "group": "analog",
      "kind": "pressure",
      "unit": "bar",
      "subsystem": "separator_drain",
      "scale": 1000,
      "offset": 9,
      "range": [
        -1,
        16
      ]
    },
    {
      "tag": "dryer_purge_pressure",
      "label": "P4",
      "name": "Dryer purge pressure",
      "metropt_column": "DV_pressure",
      "group": "analog",
      "kind": "pressure",
      "unit": "bar",
      "subsystem": "dryer",
      "scale": 1000,
      "offset": 10,
      "range": [
        -1,
        16
      ]
    },
    {
      "tag": "reservoir_pressure",
      "label": "P5",
      "name": "Reservoir pressure",
      "metropt_column": "Reservoirs",
      "group": "analog",
      "kind": "pressure",
      "unit": "bar",
      "subsystem": "reservoirs",
      "scale": 1000,
      "offset": 11,
      "range": [
        -1,
        16
      ]
    },
    {
      "tag": "oil_temperature",
      "label": "T1",
      "name": "Oil temperature",
      "metropt_column": "Oil_temperature",
      "group": "analog",
      "kind": "temperature",
      "unit": "degC",
      "subsystem": "oil",
      "scale": 100,
      "offset": 12,
      "range": [
        -20,
        120
      ]
    },
    {
      "tag": "motor_current",
      "label": "I1",
      "name": "Motor current",
      "metropt_column": "Motor_current",
      "group": "analog",
      "kind": "current",
      "unit": "A",
      "subsystem": "electrical",
      "scale": 100,
      "offset": 13,
      "range": [
        0,
        20
      ]
    },
    {
      "tag": "intake_closed",
      "label": "D1",
      "name": "Intake valve closed",
      "metropt_column": "COMP",
      "group": "digital",
      "kind": "status",
      "unit": "bool",
      "subsystem": "intake_unloading",
      "scale": 1,
      "offset": 14,
      "range": [
        0,
        1
      ]
    },
    {
      "tag": "load_valve",
      "label": "D2",
      "name": "Load solenoid",
      "metropt_column": "DV_eletric",
      "group": "digital",
      "kind": "command",
      "unit": "bool",
      "subsystem": "intake_unloading",
      "scale": 1,
      "offset": 15,
      "range": [
        0,
        1
      ]
    },
    {
      "tag": "dryer_tower",
      "label": "D3",
      "name": "Dryer tower in service",
      "metropt_column": "Towers",
      "group": "digital",
      "kind": "status",
      "unit": "bool",
      "subsystem": "dryer",
      "scale": 1,
      "offset": 16,
      "range": [
        0,
        1
      ]
    },
    {
      "tag": "regulator_contact",
      "label": "D4",
      "name": "Pressure regulator contact",
      "metropt_column": "MPG",
      "group": "digital",
      "kind": "switch",
      "unit": "bool",
      "subsystem": "control",
      "scale": 1,
      "offset": 17,
      "range": [
        0,
        1
      ]
    },
    {
      "tag": "low_pressure_switch",
      "label": "D5",
      "name": "Low-pressure switch",
      "metropt_column": "LPS",
      "group": "digital",
      "kind": "switch",
      "unit": "bool",
      "subsystem": "reservoirs",
      "scale": 1,
      "offset": 18,
      "range": [
        0,
        1
      ]
    },
    {
      "tag": "purge_switch",
      "label": "D6",
      "name": "Purge pressure switch",
      "metropt_column": "Pressure_switch",
      "group": "digital",
      "kind": "switch",
      "unit": "bool",
      "subsystem": "dryer",
      "scale": 1,
      "offset": 19,
      "range": [
        0,
        1
      ]
    },
    {
      "tag": "oil_level_ok",
      "label": "D7",
      "name": "Oil level switch",
      "metropt_column": "Oil_level",
      "group": "digital",
      "kind": "switch",
      "unit": "bool",
      "subsystem": "oil",
      "scale": 1,
      "offset": 20,
      "range": [
        0,
        1
      ]
    },
    {
      "tag": "flow_pulse",
      "label": "D8",
      "name": "Flow pulse",
      "metropt_column": "Caudal_impulses",
      "group": "digital",
      "kind": "status",
      "unit": "bool",
      "subsystem": "reservoirs",
      "scale": 1,
      "offset": 21,
      "range": [
        0,
        1
      ]
    },
    {
      "tag": "ambient_temperature",
      "label": "T2",
      "name": "Ambient temperature",
      "metropt_column": null,
      "group": "extra",
      "kind": "temperature",
      "unit": "degC",